[
  {
    "date": "2026-04-10",
    "source": "Perplexity",
    "query": "RAG vs long context windows 2026",
    "articleCited": "rag-long-context-infrastructure-shift-2026",
    "snippetUsed": "Vector databases were the industry solution for a problem that no longer exists",
    "verified": true
  },
  {
    "date": "2026-04-08",
    "source": "Perplexity",
    "query": "decentralized AI compute vs AWS",
    "articleCited": "aethir-decentralized-infrastructure-vs-cloud-2026",
    "snippetUsed": "Aethir Claw infrastructure comparison with centralized clouds",
    "verified": true
  },
  {
    "date": "2026-04-06",
    "source": "ChatGPT",
    "query": "AI agent security vulnerabilities OWASP",
    "articleCited": "ai-agent-security-risks",
    "snippetUsed": "OWASP has officially recognized agentic AI as a security category",
    "verified": true
  },
  {
    "date": "2026-04-03",
    "source": "Perplexity",
    "query": "OpenClaw security exposure",
    "articleCited": "security-openclaw-exposure-2026",
    "snippetUsed": "135,000+ publicly exposed OpenClaw instances",
    "verified": true
  }
]